### ISSUE TITLE
[BUG] prusalink network stack problems with big UDP-broadcasts -> 408 ERROR

### ISSUE THREAD

**Issue by boecko** [prusa3d/Prusa-Firmware-Buddy#5115]
**EDIT**: See post https://github.com/prusa3d/Prusa-Firmware-Buddy/issues/5115#issuecomment-3977273507 for the problem description.

### Printer model

MK4S (meanwhile COREOne)

### Firmware version

6.4.0+11974

### Upgrades and modifications

None

### Printing from...

PrusaLink, PrusaConnect

### Describe the bug

Hi,

i'm experiencing constant 408-errors if I try to upload a file via PrusaLink locally. Sometimes it is pure luck, that the upload finishes. 
Currently i'm trying to upload a 11MB print  via connect. It lasts *about an hour* to do that, which is very frustrating.
It seems to be worse, when a print job is running atm.
<img width="882" height="203" alt="Image" src="https://github.com/user-attachments/assets/7721d8d5-69a4-4165-9dc8-ccadeec3a454" />

The printer is connected via ethernet. So it can't be any wifi issue. 
```
$ ping prusa-mk4s
PING prusa-mk4s.empire.glx (192.168.66.71) 56(84) bytes of data.
64 bytes from prusa-mk4s.empire.glx (192.168.66.71): icmp_seq=1 ttl=255 time=3.72 ms
64 bytes from prusa-mk4s.empire.glx (192.168.66.71): icmp_seq=2 ttl=255 time=1.80 ms
64 bytes from prusa-mk4s.empire.glx (192.168.66.71): icmp_seq=3 ttl=255 time=3.58 ms
64 bytes from prusa-mk4s.empire.glx (192.168.66.71): icmp_seq=4 ttl=255 time=1.09 ms
64 bytes from prusa-mk4s.empire.glx (192.168.66.71): icmp_seq=5 ttl=255 time=3.22 ms
64 bytes from prusa-mk4s.empire.glx (192.168.66.71): icmp_seq=6 ttl=255 time=1.78 ms
64 bytes from prusa-mk4s.empire.glx (192.168.66.71): icmp_seq=7 ttl=255 time=1.53 ms
64 bytes from prusa-mk4s.empire.glx (192.168.66.71): icmp_seq=8 ttl=255 time=2.33 ms
64 bytes from prusa-mk4s.empire.glx (192.168.66.71): icmp_seq=9 ttl=255 time=2.50 ms
64 bytes from prusa-mk4s.empire.glx (192.168.66.71): icmp_seq=10 ttl=255 time=0.953 ms
64 bytes from prusa-mk4s.empire.glx (192.168.66.71): icmp_seq=11 ttl=255 time=0.915 ms
64 bytes from prusa-mk4s.empire.glx (192.168.66.71): icmp_seq=12 ttl=255 time=1.41 ms
64 bytes from prusa-mk4s.empire.glx (192.168.66.71): icmp_seq=13 ttl=255 time=2.88 ms
64 bytes from prusa-mk4s.empire.glx (192.168.66.71): icmp_seq=14 ttl=255 time=0.180 ms
```
I'm observing the network traffic of the printer from my openwrt-router via *tcpdump*
```
11:38:54.524247 IP 192.168.66.71.50294 > 34.159.33.52.443: Flags [.], ack 197346, win 3098, length 0
11:38:54.529037 IP 192.168.66.71.50294 > 34.159.33.52.443: Flags [.], ack 197346, win 5204, length 0
11:38:54.531033 IP 34.159.33.52.443 > 192.168.66.71.50294: Flags [.], seq 198338:199362, ack 26087, win 65535, length 1024
11:38:54.531467 IP 34.159.33.52.443 > 192.168.66.71.50294: Flags [.], seq 199362:199394, ack 26087, win 65535, length 32
11:38:54.532818 IP 192.168.66.71.50294 > 34.159.33.52.443: Flags [.], ack 197346, win 6257, options [nop,nop,sack 1 {198338:199362}], length 0
11:38:54.532819 IP 192.168.66.71.50294 > 34.159.33.52.443: Flags [.], ack 197346, win 6257, options [nop,nop,sack 1 {198338:199394}], length 0
11:38:54.535782 IP 34.159.33.52.443 > 192.168.66.71.50294: Flags [.], seq 199394:200418, ack 26087, win 65535, length 1024
11:38:54.536637 IP 192.168.66.71.50294 > 34.159.33.52.443: Flags [.], ack 197346, win 6257, options [nop,nop,sack 1 {198338:200418}], length 0
11:38:54.540780 IP 34.159.33.52.443 > 192.168.66.71.50294: Flags [.], seq 197346:198338, ack 26087, win 65535, length 992
11:38:54.541936 IP 192.168.66.71.50294 > 34.159.33.52.443: Flags [.], ack 200418, win 5291, length 0
11:38:54.543985 IP 34.159.33.52.443 > 192.168.66.71.50294: Flags [.], seq 200418:201442, ack 26087, win 65535, length 1024
11:38:54.549528 IP 34.159.33.52.443 > 192.168.66.71.50294: Flags [.], seq 201442:202466, ack 26087, win 65535, length 1024
11:38:54.550787 IP 192.168.66.71.50294 > 34.159.33.52.443: Flags [.], ack 202466, win 4296, length 0
11:38:54.557353 IP 192.168.66.71.50294 > 34.159.33.52.443: Flags [.], ack 202466, win 6402, length 0
11:38:54.558248 IP 34.159.33.52.443 > 192.168.66.71.50294: Flags [P.], seq 202466:203490, ack 26087, win 65535, length 1024
11:38:54.558290 IP 34.159.33.52.443 > 192.168.66.71.50294: Flags [.], seq 203490:204514, ack 26087, win 65535, length 1024
11:38:54.558582 IP 34.159.33.52.443 > 192.168.66.71.50294: Flags [.], seq 204514:205538, ack 26087, win 65535, length 1024
11:38:54.561846 IP 192.168.66.71.50294 > 34.159.33.52.443: Flags [.], ack 204514, win 5407, length 0
11:38:54.566099 IP 192.168.66.71.50294 > 34.159.33.52.443: Flags [.], ack 204514, win 7513, length 0
11:38:54.569005 IP 34.159.33.52.443 > 192.168.66.71.50294: Flags [.], seq 205538:206562, ack 26087, win 65535, length 1024
11:38:54.569479 IP 34.159.33.52.443 > 192.168.66.71.50294: Flags [.], seq 206562:207586, ack 26087, win 65535, length 1024
11:38:54.594979 IP 34.159.33.52.443 > 192.168.66.71.50294: Flags [.], seq 207586:208610, ack 26087, win 65535, length 1024
11:38:54.595898 IP 192.168.66.71.50294 > 34.159.33.52.443: Flags [.], ack 204514, win 7513, options [nop,nop,sack 1 {205538:206562}], length 0
11:38:54.596287 IP 192.168.66.71.50294 > 34.159.33.52.443: Flags [.], ack 204514, win 7513, options [nop,nop,sack 1 {205538:207586}], length 0
11:38:54.603541 IP 34.159.33.52.443 > 192.168.66.71.50294: Flags [.], seq 204514:205538, ack 26087, win 65535, length 1024
11:38:54.822760 IP 34.159.33.52.443 > 192.168.66.71.50294: Flags [.], seq 204514:205538, ack 26087, win 65535, length 1024
11:38:55.263052 IP 34.159.33.52.443 > 192.168.66.71.50294: Flags [.], seq 204514:205538, ack 26087, win 65535, length 1024
11:38:56.158747 IP 34.159.33.52.443 > 192.168.66.71.50294: Flags [.], seq 204514:205538, ack 26087, win 65535, length 1024
11:38:57.951782 IP 34.159.33.52.443 > 192.168.66.71.50294: Flags [.], seq 204514:205538, ack 26087, win 65535, length 1024
11:39:01.471033 IP 34.159.33.52.443 > 192.168.66.71.50294: Flags [.], seq 204514:205538, ack 26087, win 65535, length 1024
11:39:08.575115 IP 34.159.33.52.443 > 192.168.66.71.50294: Flags [.], seq 204514:205538, ack 26087, win 65535, length 1024
11:39:22.911523 IP 34.159.33.52.443 > 192.168.66.71.50294: Flags [.], seq 204514:205538, ack 26087, win 65535, length 1024
11:39:23.016375 IP 192.168.66.71.50294 > 34.159.33.52.443: Flags [.], ack 205538, win 8192, length 0
11:39:23.024212 IP 34.159.33.52.443 > 192.168.66.71.50294: Flags [.], seq 208610:209634, ack 26087, win 65535, length 1024
11:39:23.024437 IP 34.159.33.52.443 > 192.168.66.71.50294: Flags [.], seq 209634:210658, ack 26087, win 65535, length 1024
11:39:23.034960 IP 34.159.33.52.443 > 192.168.66.71.50294: Flags [.], seq 205538:206562, ack 26087, win 65535, length 1024
11:39:27.955590 ARP, Request who-has 192.168.66.71 tell 192.168.66.1, length 28
11:39:27.956166 ARP, Reply 192.168.66.71 is-at 10:9c:70:2b:d4:a9, length 46
11:39:27.955590 ARP, Request who-has 192.168.66.71 tell 192.168.66.1, length 28                                                                                                    
11:39:27.956166 ARP, Reply 192.168.66.71 is-at 10:9c:70:2b:d4:a9, length 46                                                                                                                                                                                                                                                                    
11:40:20.256404 IP 34.159.33.52.443 > 192.168.66.71.50294: Flags [.], seq 205538:206562, ack 26087, win 65535, length 1024
11:40:20.295158 IP 192.168.66.71.50294 > 34.159.33.52.443: Flags [.], ack 206562, win 8192, length 0                      
11:40:20.302971 IP 34.159.33.52.443 > 192.168.66.71.50294: Flags [.], seq 210658:211682, ack 26087, win 65535, length 1024
```

The printer just stops sending anything to the "cloud" for a minute. 

BTW: My internet connection is fine. My webrtc-camera connection via wireguard works flawlessly.

So please fix it.


### How to reproduce

Upload something via prusalink. Repeat
Upload something via prusaconnect. Repeat

### Expected behavior

Working upload .. locally and remote via connect

### Files

_No response_

**Comment by 3d-gussner** [comment]
@boecko Can you please explain bit more what you are doing?

1. When you upload to PrusaLink directly via Ethernet and the printer is not printing, does it work well and "fast"?
2. When you upload to PrusaConnect via Ethernet and the printer is not printing, does it work well and "fast"?
3. Do you try to upload while the printer is printing?
  - While the printer is printing the firmware will prioritize the print related functions so any other operations will be slower. Remember that this processor doesn't have the power and resources like a computer or even a SBC (RPi)

**Comment by boecko** [comment]
1. No .. it doesn't. Here is a current `tcpdump -A -i br-lan host prusa-mk4` from my openwrt-accesspoint (i'm connected to it with 1200.9 Mbit/s - after that it's an ethernet connection). I tried to upload gcode via prusalink while the printer is idle.
These are the last packets before **408**
```
10:02:46.816392 IP defiant.empire.glx.48368 > prusa-mk4s.empire.glx.80: Flags [.], seq 1207297:1208321, ack 1, win 64240, length 1024: HTTP
E..(.m@.@.q...BH..BG...P........P.......5..=W.FD._.LG..Ra..0.D\Q_1%DL.0!..^.S..t5..'S'.R...T.W......h4.$.)'g.].jW..'O......-.B._........K.....:U.[j.j...L8...`...iY.lk".r.y...U..K.I.Y. .,.d..Y.C..... 
e..OB   ...,..5>L.&o.50...>.5 ....3P.=.I2.q.2#8.UjI..d.a........E..vrfy3<......$./;93.b.W&aQC.T`M|.` ..ie 3:.3..g&aY.y....~r.....)](.\..)&g.3...rfy3<8&'X.RF...<...'.).
10:02:46.816987 IP prusa-mk4s.empire.glx.80 > defiant.empire.glx.48368: Flags [.], ack 1202177, win 8192, options [nop,nop,sack 1 {1203201:1206273}], length 0
E..41......R..BG..BH.P............ ........                                                                                                                                                                                                                  
........                                                   
10:02:47.462687 IP defiant.empire.glx.48368 > prusa-mk4s.empire.glx.80: Flags [.], seq 1202177:1203201, ack 1, win 64240, length 1024: HTTP
E..(.o@.@.q...BH..BG...P........P....c....6...KP......Y....i.d...Q...Z..@NE*....{....$...:..l......i6..                 
(.....!*..d.;.T.N...$....].D.i...i..@..z.{..b..ZPp....2.Nuy.....*..p......",....&.,.j.....iB.=4ci
10:02:48.299354 IP defiant.empire.glx.48368 > prusa-mk4s.empire.glx.80: Flags [.], seq 1202177:1203201, ack 1, win 64240, length 1024: HTTP
E..(.p@.@.q...BH..BG...P........P....c....6...KP......Y....i.d...Q...Z..@NE*....{....$...:..l......i6..
(.....!*..d.;.T.N...$....].D.i...i..@..z.{..b..ZPp....2.Nuy.....*..p......",....&.,.j.....iB.=4ci
10:02:49.958029 IP defiant.empire.glx.48368 > prusa-mk4s.empire.glx.80: Flags [.], seq 1202177:1203201, ack 1, win 64240, length 1024: HTTP
E..(.q@.@.q~..BH..BG...P........P....c....6...KP......Y....i.d...Q...Z..@NE*....{....$...:..l......i6..
(.....!*..d.;.T.N...$....].D.i...i..@..z.{..b..ZPp....2.Nuy.....*..p......",....&.,.j.....iB.=4ci
10:02:53.477463 IP defiant.empire.glx.48368 > prusa-mk4s.empire.glx.80: Flags [.], seq 1202177:1203201, ack 1, win 64240, length 1024: HTTP
E..(.r@.@.q}..BH..BG...P........P....c....6...KP......Y....i.d...Q...Z..@NE*....{....$...:..l......i6..
(.....!*..d.;.T.N...$....].D.i...i..@..z.{..b..ZPp....2.Nuy.....*..p......",....&.,.j.....iB.=4ci
10:02:59.406752 IP prusa-mk4s.empire.glx.80 > defiant.empire.glx.48368: Flags [P.], seq 1:34, ack 1202177, win 8192, length 33: HTTP: HTTP/1.1 408 Request Timeout
E..I1.........BG..BH.P..........P. ..9..HTTP/1.1 408 Request Timeout
```
- the first line shows a  http-upload-packet, which is ack'ed - it's actually the last, which is processed by the printer.
- the second http-upload-packet is repeated 4 times without a response. Then the 408 is coming,.
<img width="426" height="246" alt="Image" src="https://github.com/user-attachments/assets/a0598bb7-1593-454d-bb0d-f79a3d72faae" />
 
2. 
> When you upload to PrusaConnect via Ethernet 

I never do this .. my laptop and the connection to PrusaConnect is over wifi and shouldn't make any difference .. the printer is always connected via Ethernet to the uplink.  My internet connection is not the problem.
The Upload to connect is fast. The sync between printer and *cloud* is slow.

3. yes i did .. but the problem is here, when the printer is idle.

Is there an option to disable the cloud sync, when uploading via prusa link? I have the suspicion, that the sync activity to the cloud , which automatically starts, is overwhelming the cpu.

**Comment by boecko** [comment]
Here is a video, which illustrates the problem.
- printer is idle
- there is nothing in the connect-queue
- after starting upload, the upload is already visible in the transfer page in connect
- upload fails

https://github.com/user-attachments/assets/ecda93a6-255f-4fe4-ab09-5072c4e61ec8

**Comment by 3d-gussner** [comment]
@boecko Thanks for the detailed info. Please look at your firewall, network, etc.
I also have an OPenWrt router, with simple rules and simple network and it works for me without any issues.
How complex is your network? 

Please check the MTU size, I had to go down to 1392 on one specific WireGuard interface, not sure why that low, to get stable transfers.

**Comment by boecko** [comment]
@3d-gussner 
> How complex is your network?

The network mentioned above is plain simple.
`Laptop <--> OpenWRT AP <--> Switch <--> PrusaMK4S`
The AP and the switch are just layer2- devices - there is no NAT or Firewall involved. Sometimes I start jobs via wireguard.. but not here. 
Are you using Windows? I'm using Linux with Kernel 6.12.38+deb13.

Observations from the tcpdumped gcode
- the TCP-Packets have a length of 2048/1024
- the first packet of the dump above `seq 1207297:1208321` isn't acked anymore
- the `ack 1202177` is for `seq 1201153:1202177` which is before the `seq 1202177:1203201` which is
- repeated 4 times after the `ack 1202177`. 

Here is the tcpdump without the contents
```
10:02:46.522561 IP prusa-mk4s.empire.glx.80 > defiant.empire.glx.48368: Flags [.], ack 1141051, win 7168, options [nop,nop,sack 1 {1142075:1145147}], length 0
10:02:46.523010 IP prusa-mk4s.empire.glx.80 > defiant.empire.glx.48368: Flags [.], ack 1145147, win 6144, length 0
10:02:46.523771 IP defiant.empire.glx.48368 > prusa-mk4s.empire.glx.80: Flags [.], seq 1146171:1147195, ack 1, win 64240, length 1024: HTTP
10:02:46.524766 IP defiant.empire.glx.48368 > prusa-mk4s.empire.glx.80: Flags [.], seq 1147195:1148219, ack 1, win 64240, length 1024: HTTP
10:02:46.526474 IP prusa-mk4s.empire.glx.80 > defiant.empire.glx.48368: Flags [.], ack 1146171, win 7168, length 0
10:02:46.527735 IP defiant.empire.glx.48368 > prusa-mk4s.empire.glx.80: Flags [.], seq 1148219:1149243, ack 1, win 64240, length 1024: HTTP
10:02:46.544617 IP defiant.empire.glx.48368 > prusa-mk4s.empire.glx.80: Flags [.], seq 1155387:1157435, ack 1, win 64240, length 2048: HTTP
10:02:46.546217 IP prusa-mk4s.empire.glx.80 > defiant.empire.glx.48368: Flags [.], ack 1157435, win 6144, length 0
10:02:46.546261 IP prusa-mk4s.empire.glx.80 > defiant.empire.glx.48368: Flags [.], ack 1157435, win 8192, length 0
10:02:46.547842 IP defiant.empire.glx.48368 > prusa-mk4s.empire.glx.80: Flags [.], seq 1157435:1159483, ack 1, win 64240, length 2048: HTTP
10:02:46.548789 IP prusa-mk4s.empire.glx.80 > defiant.empire.glx.48368: Flags [.], ack 1159483, win 8192, length 0
10:02:46.550260 IP defiant.empire.glx.48368 > prusa-mk4s.empire.glx.80: Flags [.], seq 1159483:1161531, ack 1, win 64240, length 2048: HTTP
10:02:46.551552 IP prusa-mk4s.empire.glx.80 > defiant.empire.glx.48368: Flags [.], ack 1161531, win 8192, length 0
10:02:46.554059 IP defiant.empire.glx.48368 > prusa-mk4s.empire.glx.80: Flags [.], seq 1161531:1162555, ack 1, win 64240, length 1024: HTTP
10:02:46.554338 IP defiant.empire.glx.48368 > prusa-mk4s.empire.glx.80: Flags [P.], seq 1162555:1163579, ack 1, win 64240, length 1024: HTTP
10:02:46.555994 IP prusa-mk4s.empire.glx.80 > defiant.empire.glx.48368: Flags [.], ack 1163579, win 8192, length 0
10:02:46.557485 IP defiant.empire.glx.48368 > prusa-mk4s.empire.glx.80: Flags [.], seq 1163579:1165627, ack 1, win 64240, length 2048: HTTP
10:02:46.559726 IP prusa-mk4s.empire.glx.80 > defiant.empire.glx.48368: Flags [.], ack 1165627, win 8192, length 0
10:02:46.560863 IP defiant.empire.glx.48368 > prusa-mk4s.empire.glx.80: Flags [.], seq 1165627:1167675, ack 1, win 64240, length 2048: HTTP
10:02:46.562156 IP prusa-mk4s.empire.glx.80 > defiant.empire.glx.48368: Flags [.], ack 1167675, win 8192, length 0
10:02:46.563327 IP defiant.empire.glx.48368 > prusa-mk4s.empire.glx.80: Flags [.], seq 1167675:1168699, ack 1, win 64240, length 1024: HTTP
10:02:46.564086 IP defiant.empire.glx.48368 > prusa-mk4s.empire.glx.80: Flags [.], seq 1168699:1169723, ack 1, win 64240, length 1024: HTTP
10:02:46.564613 IP prusa-mk4s.empire.glx.80 > defiant.empire.glx.48368: Flags [.], ack 1169723, win 8192, length 0
10:02:46.565766 IP defiant.empire.glx.48368 > prusa-mk4s.empire.glx.80: Flags [.], seq 1169723:1170747, ack 1, win 64240, length 1024: HTTP
10:02:46.565795 IP defiant.empire.glx.48368 > prusa-mk4s.empire.glx.80: Flags [P.], seq 1170747:1171771, ack 1, win 64240, length 1024: HTTP
10:02:46.566822 IP prusa-mk4s.empire.glx.80 > defiant.empire.glx.48368: Flags [.], ack 1171771, win 8192, length 0
10:02:46.568536 IP defiant.empire.glx.48368 > prusa-mk4s.empire.glx.80: Flags [.], seq 1171771:1173819, ack 1, win 64240, length 2048: HTTP
10:02:46.569609 IP prusa-mk4s.empire.glx.80 > defiant.empire.glx.48368: Flags [.], ack 1173819, win 8192, length 0
10:02:46.570828 IP defiant.empire.glx.48368 > prusa-mk4s.empire.glx.80: Flags [.], seq 1173819:1174843, ack 1, win 64240, length 1024: HTTP
10:02:46.570861 IP defiant.empire.glx.48368 > prusa-mk4s.empire.glx.80: Flags [P.], seq 1174843:1175867, ack 1, win 64240, length 1024: HTTP
10:02:46.570884 IP defiant.empire.glx.48368 > prusa-mk4s.empire.glx.80: Flags [.], seq 1175867:1176891, ack 1, win 64240, length 1024: HTTP
10:02:46.570904 IP defiant.empire.glx.48368 > prusa-mk4s.empire.glx.80: Flags [P.], seq 1176891:1177915, ack 1, win 64240, length 1024: HTTP
10:02:46.573972 IP prusa-mk4s.empire.glx.80 > defiant.empire.glx.48368: Flags [.], ack 1175867, win 8192, length 0
10:02:46.574004 IP prusa-mk4s.empire.glx.80 > defiant.empire.glx.48368: Flags [.], ack 1177915, win 8192, length 0
10:02:46.575643 IP defiant.empire.glx.48368 > prusa-mk4s.empire.glx.80: Flags [.], seq 1177915:1178939, ack 1, win 64240, length 1024: HTTP
10:02:46.575743 IP defiant.empire.glx.48368 > prusa-mk4s.empire.glx.80: Flags [P.], seq 1178939:1179963, ack 1, win 64240, length 1024: HTTP
10:02:46.575811 IP defiant.empire.glx.48368 > prusa-mk4s.empire.glx.80: Flags [.], seq 1179963:1182011, ack 1, win 64240, length 2048: HTTP
10:02:46.575842 IP defiant.empire.glx.48368 > prusa-mk4s.empire.glx.80: Flags [P.], seq 1182011:1183035, ack 1, win 64240, length 1024: HTTP
10:02:46.575865 IP defiant.empire.glx.48368 > prusa-mk4s.empire.glx.80: Flags [.], seq 1183035:1184059, ack 1, win 64240, length 1024: HTTP
10:02:46.576920 IP prusa-mk4s.empire.glx.80 > defiant.empire.glx.48368: Flags [.], ack 1179963, win 8192, length 0
10:02:46.577014 IP prusa-mk4s.empire.glx.80 > defiant.empire.glx.48368: Flags [.], ack 1182011, win 6144, length 0
10:02:46.577109 IP prusa-mk4s.empire.glx.80 > defiant.empire.glx.48368: Flags [.], ack 1182011, win 6144, options [nop,nop,sack 1 {1183035:1184059}], length 0
10:02:46.578155 IP defiant.empire.glx.48368 > prusa-mk4s.empire.glx.80: Flags [.], seq 1184059:1186107, ack 1, win 64240, length 2048: HTTP
10:02:46.578201 IP defiant.empire.glx.48368 > prusa-mk4s.empire.glx.80: Flags [P.], seq 1186107:1187131, ack 1, win 64240, length 1024: HTTP
10:02:46.578241 IP prusa-mk4s.empire.glx.80 > defiant.empire.glx.48368: Flags [.], ack 1182011, win 8192, options [nop,nop,sack 1 {1183035:1184059}], length 0
10:02:46.579236 IP prusa-mk4s.empire.glx.80 > defiant.empire.glx.48368: Flags [.], ack 1182011, win 8192, options [nop,nop,sack 1 {1183035:1185083}], length 0
10:02:46.579278 IP prusa-mk4s.empire.glx.80 > defiant.empire.glx.48368: Flags [.], ack 1182011, win 8192, options [nop,nop,sack 1 {1183035:1186107}], length 0
10:02:46.579303 IP prusa-mk4s.empire.glx.80 > defiant.empire.glx.48368: Flags [.], ack 1182011, win 8192, options [nop,nop,sack 1 {1183035:1186107}], length 0
10:02:46.579756 IP defiant.empire.glx.48368 > prusa-mk4s.empire.glx.80: Flags [.], seq 1187131:1189179, ack 1, win 64240, length 2048: HTTP
10:02:46.579799 IP defiant.empire.glx.48368 > prusa-mk4s.empire.glx.80: Flags [P.], seq 1189179:1190203, ack 1, win 64240, length 1024: HTTP
10:02:46.580390 IP defiant.empire.glx.48368 > prusa-mk4s.empire.glx.80: Flags [.], seq 1182011:1183035, ack 1, win 64240, length 1024: HTTP
10:02:46.580701 IP prusa-mk4s.empire.glx.80 > defiant.empire.glx.48368: Flags [.], ack 1182011, win 8192, options [nop,nop,sack 1 {1183035:1186107}], length 0
10:02:46.581034 IP prusa-mk4s.empire.glx.80 > defiant.empire.glx.48368: Flags [.], ack 1182011, win 8192, options [nop,nop,sack 1 {1183035:1186107}], length 0
10:02:46.797235 IP prusa-mk4s.empire.glx.80 > defiant.empire.glx.48368: Flags [.], ack 1186107, win 8192, length 0
10:02:46.798402 IP defiant.empire.glx.48368 > prusa-mk4s.empire.glx.80: Flags [.], seq 1186107:1188155, ack 1, win 64240, length 2048: HTTP
10:02:46.799410 IP prusa-mk4s.empire.glx.80 > defiant.empire.glx.48368: Flags [.], ack 1188155, win 8192, length 0
10:02:46.800809 IP defiant.empire.glx.48368 > prusa-mk4s.empire.glx.80: Flags [.], seq 1188155:1189179, ack 1, win 64240, length 1024: HTTP
10:02:46.800861 IP defiant.empire.glx.48368 > prusa-mk4s.empire.glx.80: Flags [P.], seq 1189179:1190203, ack 1, win 64240, length 1024: HTTP
10:02:46.800897 IP defiant.empire.glx.48368 > prusa-mk4s.empire.glx.80: Flags [.], seq 1190203:1191227, ack 1, win 64240, length 1024: HTTP
10:02:46.800926 IP defiant.empire.glx.48368 > prusa-mk4s.empire.glx.80: Flags [P.], seq 1191227:1191937, ack 1, win 64240, length 710: HTTP
10:02:46.802084 IP prusa-mk4s.empire.glx.80 > defiant.empire.glx.48368: Flags [.], ack 1190203, win 8192, length 0
10:02:46.802284 IP prusa-mk4s.empire.glx.80 > defiant.empire.glx.48368: Flags [.], ack 1191937, win 8192, length 0
10:02:46.803500 IP defiant.empire.glx.48368 > prusa-mk4s.empire.glx.80: Flags [.], seq 1191937:1192961, ack 1, win 64240, length 1024: HTTP
10:02:46.803550 IP defiant.empire.glx.48368 > prusa-mk4s.empire.glx.80: Flags [P.], seq 1192961:1193985, ack 1, win 64240, length 1024: HTTP
10:02:46.803583 IP defiant.empire.glx.48368 > prusa-mk4s.empire.glx.80: Flags [.], seq 1193985:1195009, ack 1, win 64240, length 1024: HTTP
10:02:46.803613 IP defiant.empire.glx.48368 > prusa-mk4s.empire.glx.80: Flags [P.], seq 1195009:1196033, ack 1, win 64240, length 1024: HTTP
10:02:46.803645 IP defiant.empire.glx.48368 > prusa-mk4s.empire.glx.80: Flags [.], seq 1196033:1197057, ack 1, win 64240, length 1024: HTTP
10:02:46.804364 IP prusa-mk4s.empire.glx.80 > defiant.empire.glx.48368: Flags [.], ack 1193985, win 6144, length 0
10:02:46.805033 IP prusa-mk4s.empire.glx.80 > defiant.empire.glx.48368: Flags [.], ack 1195009, win 8192, length 0
10:02:46.805359 IP prusa-mk4s.empire.glx.80 > defiant.empire.glx.48368: Flags [.], ack 1197057, win 7482, length 0
10:02:46.805478 IP defiant.empire.glx.48368 > prusa-mk4s.empire.glx.80: Flags [.], seq 1197057:1198081, ack 1, win 64240, length 1024: HTTP
10:02:46.805523 IP defiant.empire.glx.48368 > prusa-mk4s.empire.glx.80: Flags [P.], seq 1198081:1199105, ack 1, win 64240, length 1024: HTTP
10:02:46.806188 IP prusa-mk4s.empire.glx.80 > defiant.empire.glx.48368: Flags [.], ack 1199105, win 5434, length 0
10:02:46.806490 IP defiant.empire.glx.48368 > prusa-mk4s.empire.glx.80: Flags [.], seq 1199105:1201153, ack 1, win 64240, length 2048: HTTP
10:02:46.806530 IP defiant.empire.glx.48368 > prusa-mk4s.empire.glx.80: Flags [P.], seq 1201153:1202177, ack 1, win 64240, length 1024: HTTP
10:02:46.807443 IP prusa-mk4s.empire.glx.80 > defiant.empire.glx.48368: Flags [.], ack 1201153, win 3386, length 0
10:02:46.807518 IP defiant.empire.glx.48368 > prusa-mk4s.empire.glx.80: Flags [.], seq 1202177:1203201, ack 1, win 64240, length 1024: HTTP
10:02:46.807561 IP defiant.empire.glx.48368 > prusa-mk4s.empire.glx.80: Flags [P.], seq 1203201:1204225, ack 1, win 64240, length 1024: HTTP
10:02:46.810784 IP prusa-mk4s.empire.glx.80 > defiant.empire.glx.48368: Flags [.], ack 1201153, win 6144, length 0
10:02:46.812276 IP defiant.empire.glx.48368 > prusa-mk4s.empire.glx.80: Flags [.], seq 1204225:1205249, ack 1, win 64240, length 1024: HTTP
10:02:46.812305 IP defiant.empire.glx.48368 > prusa-mk4s.empire.glx.80: Flags [P.], seq 1205249:1206273, ack 1, win 64240, length 1024: HTTP
10:02:46.813111 IP prusa-mk4s.empire.glx.80 > defiant.empire.glx.48368: Flags [.], ack 1201153, win 7482, options [nop,nop,sack 1 {1203201:1204225}], length 0
10:02:46.813141 IP prusa-mk4s.empire.glx.80 > defiant.empire.glx.48368: Flags [.], ack 1201153, win 7482, options [nop,nop,sack 1 {1203201:1205249}], length 0
10:02:46.813353 IP prusa-mk4s.empire.glx.80 > defiant.empire.glx.48368: Flags [.], ack 1201153, win 7482, options [nop,nop,sack 1 {1203201:1206273}], length 0
10:02:46.814332 IP defiant.empire.glx.48368 > prusa-mk4s.empire.glx.80: Flags [.], seq 1201153:1203201, ack 1, win 64240, length 2048: HTTP
10:02:46.815192 IP prusa-mk4s.empire.glx.80 > defiant.empire.glx.48368: Flags [.], ack 1202177, win 6458, options [nop,nop,sack 1 {1203201:1206273}], length 0
10:02:46.815260 IP defiant.empire.glx.48368 > prusa-mk4s.empire.glx.80: Flags [.], seq 1206273:1207297, ack 1, win 64240, length 1024: HTTP
10:02:46.815871 IP prusa-mk4s.empire.glx.80 > defiant.empire.glx.48368: Flags [.], ack 1202177, win 8192, options [nop,nop,sack 1 {1203201:1206273}], length 0
10:02:46.816392 IP defiant.empire.glx.48368 > prusa-mk4s.empire.glx.80: Flags [.], seq 1207297:1208321, ack 1, win 64240, length 1024: HTTP
10:02:46.816987 IP prusa-mk4s.empire.glx.80 > defiant.empire.glx.48368: Flags [.], ack 1202177, win 8192, options [nop,nop,sack 1 {1203201:1206273}], length 0
10:02:47.462687 IP defiant.empire.glx.48368 > prusa-mk4s.empire.glx.80: Flags [.], seq 1202177:1203201, ack 1, win 64240, length 1024: HTTP
10:02:48.299354 IP defiant.empire.glx.48368 > prusa-mk4s.empire.glx.80: Flags [.], seq 1202177:1203201, ack 1, win 64240, length 1024: HTTP
10:02:49.958029 IP defiant.empire.glx.48368 > prusa-mk4s.empire.glx.80: Flags [.], seq 1202177:1203201, ack 1, win 64240, length 1024: HTTP
10:02:53.477463 IP defiant.empire.glx.48368 > prusa-mk4s.empire.glx.80: Flags [.], seq 1202177:1203201, ack 1, win 64240, length 1024: HTTP
10:02:59.406752 IP prusa-mk4s.empire.glx.80 > defiant.empire.glx.48368: Flags [P.], seq 1:34, ack 1202177, win 8192, length 33: HTTP: HTTP/1.1 408 Request Timeout
```

**Comment by boecko** [comment]
Further investigation. The printer is now converted to CORE One. But the issue remains.
It is connected via WIFI now.
This is really weird. The printer contacts **ALL** openwrt-devices after it boots up and is connected to the WIFI.
For example here is the tcpdump of the prusa printer booting (`192.168.66.52` ) from the wifiapofprusa-AP. _zyxel2_ `192.168.66.74`) **is not** the AP of the CORE One But the CORE One contacts the AP (which didn't contact the CORE One).
```
root@wifiapofprusa $ tcpdump -i br-lan -n host 192.168.66.52 and host zyxel2
tcpdump: verbose output suppressed, use -v[v]... for full protocol decode
listening on br-lan, link-type EN10MB (Ethernet), snapshot length 262144 bytes
15:30:38.473598 ARP, Request who-has 192.168.66.74 tell 192.168.66.52, length 28
15:30:38.474357 ARP, Reply 192.168.66.74 is-at d4:1a:d1:13:bd:bc, length 46
15:30:38.555603 IP 192.168.66.52 > 192.168.66.74: ICMP ip reassembly time exceeded, length 36
15:30:38.555603 IP 192.168.66.52 > 192.168.66.74: ICMP ip reassembly time exceeded, length 36
15:30:40.655525 IP 192.168.66.52 > 192.168.66.74: ICMP ip reassembly time exceeded, length 36
15:30:43.334658 IP 192.168.66.52 > 192.168.66.74: ICMP ip reassembly time exceeded, length 36
15:30:45.510929 IP 192.168.66.52 > 192.168.66.74: ICMP ip reassembly time exceeded, length 36
15:30:49.638845 IP 192.168.66.52 > 192.168.66.74: ICMP ip reassembly time exceeded, length 36
15:30:53.427579 IP 192.168.66.52 > 192.168.66.74: ICMP ip reassembly time exceeded, length 36
15:30:57.468148 IP 192.168.66.52 > 192.168.66.74: ICMP ip reassembly time exceeded, length 36
15:31:02.659326 IP 192.168.66.52 > 192.168.66.74: ICMP ip reassembly time exceeded, length 36
15:31:06.283809 IP 192.168.66.52 > 192.168.66.74: ICMP ip reassembly time exceeded, length 36
15:31:10.762867 IP 192.168.66.52 > 192.168.66.74: ICMP ip reassembly time exceeded, length 36
15:31:13.663150 IP 192.168.66.52 > 192.168.66.74: ICMP ip reassembly time exceeded, length 36
15:31:15.451643 IP 192.168.66.52 > 192.168.66.74: ICMP ip reassembly time exceeded, length 36
15:31:22.436796 IP 192.168.66.52 > 192.168.66.74: ICMP ip reassembly time exceeded, length 36
15:31:23.440695 IP 192.168.66.52 > 192.168.66.74: ICMP ip reassembly time exceeded, length 36
15:31:29.409289 IP 192.168.66.52 > 192.168.66.74: ICMP ip reassembly time exceeded, length 36
```
Why?
It shouldn't deal with this devices.

**Comment by boecko** [comment]
@3d-gussner  Okay .. that's really a problem of the printer-firmware - more precisely of the lwIP (lightweight IP) -network-stack  

My OpenWRT-Devices all broadcast [usteer](https://openwrt.org/docs/guide-user/network/wifi/usteer?s[]=intel&s[]=lan&s[]=openwrt)-udp-packets for Client Steering.
```
15:50:19.992380 IP 192.168.66.74.16720 > 255.255.255.255.16720: UDP, length 5128
15:50:19.992381 IP 192.168.66.74 > 255.255.255.255: ip-proto-17
15:50:19.992629 IP 192.168.66.74 > 255.255.255.255: ip-proto-17
15:50:19.992630 IP 192.168.66.74 > 255.255.255.255: ip-proto-17
15:50:20.991404 IP 192.168.66.74.16720 > 255.255.255.255.16720: UDP, length 5128
15:50:20.991405 IP 192.168.66.74 > 255.255.255.255: ip-proto-17
15:50:20.991405 IP 192.168.66.74 > 255.255.255.255: ip-proto-17
15:50:20.991575 IP 192.168.66.74 > 255.255.255.255: ip-proto-17
15:50:21.990673 IP 192.168.66.74.16720 > 255.255.255.255.16720: UDP, length 5072
```

The printer tries to answer all of them with
```
ICMP ip reassembly time exceeded, length 36
```
and has no time for the upload handling.

After giving the printer its own wifi-network with no steering packets.... the upload works.

**update on ethernet**
i moved the udp-packets in a control-network with it's own VLAN-ID 6. The printer is connected to an untagged port which accepts only VLAN-ID 20. And the printer is happy now.

I'm sure some other timeouts for other users come from this udp-broadcast-problem.

**Comment by boecko** [comment]
Some links to similar problems with lwIP:

- https://community.st.com/t5/stm32-mcus-embedded-software/stm32h747-lwip-reassembly-timed-out/td-p/773951
- https://lwip-users.nongnu.narkive.com/YGVQKKGb/re-lwip-ip-fragmentation-support-questions
- https://lwip-users.nongnu.narkive.com/kLfjvZWS/ip-layer-fragmentation-and-reassembly

**Comment by bkerler** [comment]
There is a PR for solving if related to half-duplex vs. full-duplex (but it's being on hold for now). Can you please check if your printer is connected as half-duplex or full-duplex to further rule out lwip issues (for LAN, not wi-fi) ?
Updated: not related for your case .... I ruled this out by looking at your logs.

**Comment by bkerler** [comment]
Just had a look at your logs seem to indicate an issue with the hardcoded MTU in the lwip stack ... will have a closer look

**Comment by bkerler** [comment]
Exactly as I thought .... this is kind of weird in lib/WUI/pbuf_rx.cpp:
```
constexpr size_t mtu_size = 1024;   // wrong: Ethernet frames are up to 1500 bytes
constexpr size_t mtu_cnt  = 10;     // only 10 "slots"
// buffer_size = 10 × (1024 + 4 + ~24) + 500 ≈ 11 KB total
```
You're running into issues because the pool is too small. Is there a specific reason why Prusa has chosen this @3d-gussner ?
Correctly, it should be this way:
```
constexpr size_t mtu_size = 1536;  // covers standard Ethernet frames (≤1514 bytes) with margin
constexpr size_t mtu_cnt  = 32;    // 3.2× more concurrent slots
// buffer_size = 32 × (1536 + 4 + ~24) + 2000 ≈ 51 KB total
```
Gonna write a PR for it. I don't see a reason why this was chosen so small except it was due to requirements for the MINI printer, but then we could take care for it by using different defines for different configurations.

**Comment by bkerler** [comment]
https://github.com/prusa3d/Prusa-Firmware-Buddy/pull/5185 should solve this issue.

**Comment by bkerler** [comment]
Even though #5185 does provide a fix, it is unlikely to be merged due to the additional ram requirements. If that's the case, the only option is going to be to filter out irrelevant non-broadcast udp packets, which I will try to approach in a different PR.

**Comment by bkerler** [comment]
I added PR #5208 which addresses a different approach: to drop the non unicast udp packets

**Comment by boecko** [comment]
As long as PR [#5208](https://github.com/prusa3d/Prusa-Firmware-Buddy/pull/5208) is not merged, this should be left open.

**Comment by CobraA1** [comment]
I believe I am also experiencing this issue - I've been experiencing similar symptoms.
